Elemento,Descripcion,Banco
Pádel Maitencillo Todos los días," Descuento no aplica sobre otras promociones o descuentos. Promoción válida todos los días de marzo 2025, consiste en un 20% Dcto. en la reserva de Canchas en Padel Maitencillo. Accede a este beneficio pagando con Tarjetas de Débito y/o Crédito Scotiabank. El beneficio se hará efectivo previa reserva llamando al +56941510348. El descuento se hará efectivo al momento del pago anunciando método de pago Scotia en caja. Descuento no aplica sobre otras promociones o descuentos. Beneficio intransferible. Se excluyen de esta promoción las Tarjetas Empresariales, Corporativas, Mastercard Business, Visa Business, Visa Enjoy, Visa Movistar, Visa Forum, Visa Congelada, Visa Crédito Express, Visa Bex y Tarjeta Universal, al igual que las Tarjetas de Crédito Cencosud Scotiabank, emitidas por su filial. El pago con tarjetas de crédito puede tener costos asociados. Consulta con el emisor de la tarjeta para mayor información. ",Banco ScotiaBank
Pádel Shop Chile Todos los dias," Pagando con tus Tarjetas de Débito y/o Crédito Scotiabank.
El despacho y los tiempos del mismo son de exclusiva responsabilidad del comercio.
No acumulable con otras promociones o descuentos. ",Banco ScotiaBank
Just Burger Todos los jueves," Tope del descuento $20.000 por cliente titular.
Un uso por cliente a la semana.
Válido solo para compras con boleta.
No incluye costos de despacho.
Exclusivo clientes Scotiabank.
Los tiempos y condiciones de despacho son de exclusiva responsabilidad del comercio.  Promoción válida todos los jueves de marzo de 2025 o hasta agotar fondo promocional de $3.000.000, lo que ocurra primero. Promoción consiste en 40% Dcto. Válido para compras en tienda online www.justburger.cl y la App Just Burger, ingresando como código de descuento los primeros 6 números de la Tarjeta. Con tope de $20.000 por cliente titular. Pagando con Tarjetas de Débito o Crédito Scotiabank Signature, Infinite y Singular y Wealth Mnagement. Descuentos no acumulable sobre otras promociones o descuentos. Máximo un uso semanal por cliente. Válido para retiro en tienda y despacho a domicilio. No incluye costos de despacho. Los tiempos y condiciones de despacho son de exclusiva responsabilidad del comercio. Válido solo para compras con boleta. Se excluyen de esta promoción las Tarjetas de Crédito Visa y Mastercard Scotia Gold, Platinum, Mastercard Black, Tarjetas Empresariales, Corporativas, Mastercard Business, Visa Business, Visa Enjoy, Visa Movistar, Visa Forum, Visa Congelada, Visa Crédito Express, Visa Bex y Tarjeta Universal, al igual que las Tarjetas de Crédito Cencosud Scotiabank, emitidas por su filial. El pago con tarjetas de crédito puede tener costos asociados. Consulta con el emisor de la tarjeta para mayor información.",Banco ScotiaBank
Be Well Todos los días,"  Promoción válida hasta el 30 de junio de 2025. Promoción consiste en 40% de descuento en tienda online www.bewell.cl. Aplica pagando con Tarjetas de Débito o Crédito Scotiabank e ingresando código descuento BEWELLSCOTIACLUB. Exclusivo para clientes Scotiabank. No acumulable con otras promociones o convenios. Promoción exclusiva para despachos en Región Metropolitana. Máximo 4 cajas por compra. Se excluyen de esta promoción las Tarjetas Empresariales, Corporativas, Mastercard Business, Visa Business, Visa Enjoy, Visa Movistar, Visa Forum, Visa Congelada, Visa Crédito Express, Visa Bex y Tarjeta Universal, al igual que las Tarjetas de Crédito Cencosud Scotiabank, emitidas por su filial. El pago con tarjetas de crédito puede tener costos asociados. Consulta con el emisor de la tarjeta para mayor información. ",Banco ScotiaBank
PZ Todos los días," Máximo 1 uso de cupón por cliente.
Promoción no acumulable con otras promociones.
No incluye costo de despacho.
  ",Banco ScotiaBank
Mingo Todos los días ," Pagando con Tarjetas de Crédito y/o Débito Scotia.
Máximo 1 uso de cupón por cliente.  ",Banco ScotiaBank
16 Hrs. Todos lo días,"   Pagando con Tarjetas de Débito o Crédito Visa Scotia.
Máximo 1 uso de cupón por cliente.
El despacho y los tiempos del mismo son de exclusiva responsabilidad del comercio.
Promoción no acumulable con otras promociones.  Promoción válida hasta el 31 de marzo de 2025. Promoción consiste en un 20% Dcto. en www.16hrs.cl/catalogo/466-alianzas.  Pagando con Tarjetas de  Débito o CréditoVisa Scotia. El descuento se hace efectivo pagando con Tarjetas de Crédito y/o Débito Scotia ingresando cupón de descuento: SCT16HRS20 Máximo 1 uso de cupón por cliente. El despacho y los tiempos del mismo son de exclusiva responsabilidad del comercio. Promoción no acumulable con otras promociones. Se excluyen de esta promoción las Tarjetas Empresariales, Corporativas, Mastercard Business, Visa Business, Visa Enjoy, Visa Movistar, Visa Forum, Visa Congelada, Visa Crédito Express, Visa Bex y Tarjeta Universal, al igual que las Tarjetas de Crédito Cencosud Scotiabank, emitidas por su filial. El pago con tarjetas de crédito puede tener costos asociados. Consulta con el emisor de la tarjeta para mayor información.",Banco ScotiaBank
Pollini Todos los días," Máximo 1 uso de cupón por cliente.
Promoción no acumulable con otras promociones.
No incluye costo de despacho.
  ",Banco ScotiaBank
Cantarina Joyas Todos los días," No incluye costo de despacho.
Promoción no acumulable con otras promociones o descuentos.
Descuento válido solo para joyas. Promoción válida hasta 31 de diciembre de 2025. Promoción consiste en un 25% Dcto. todos los días en www.cantarinajoyas.com. Pagando con Tarjetas de Crédito y/o Débito Scotia. El despacho y los tiempos del mismo son de exclusiva responsabilidad del comercio. No incluye costo de despacho. Promoción no acumulable con otras promociones o descuentos. El beneficio se hace efectivo Ingresando código de descuento SCOTIAJOYAS. Descuento exclusivo en joyas Se excluyen de esta promoción las Tarjetas  Empresariales, Corporativas, Mastercard Business, Visa Business, Visa Enjoy, Visa Movistar, Visa Forum, Visa Congelada, Visa Crédito Express, Visa Bex y Tarjeta Universal, al igual que las Tarjetas de Crédito Cencosud Scotiabank, emitidas por su filial. el pago con tarjetas de crédito puede tener costos asociados. Consulta con el emisor de la tarjeta para mayor información.",Banco ScotiaBank
Ohmypets Todos los días," Descuento exclusivo para clientes Scotia.
No acumulable sobre otras promociones o descuentos.
No aplica para promoción de  3 pares de calcetines largos o cortos.
El costo del despacho y los tiempos del mismo son de exclusiva responsabilidad del comercio.
  ",Banco ScotiaBank
Panamá Jack Todos los días," Descuento exclusivo para clientes Scotia.
Promoción no acumulable con otras promociones.
No incluye costos de despacho.
1 uso de cupón por cliente. ",Banco ScotiaBank
Zappa Todos los días ," Máximo 1 uso de cupón por cliente.
Promoción no acumulable con otras promociones.
No incluye costo de despacho.
  ",Banco ScotiaBank
Malévolo Pizza De lunes a miércoles," No incluye costo de despacho.
El despacho y los tiempos del mismos son de exclusiva responsabilidad del comercio.
Exclusivo Pagando con Tarjetas de Débito o Crédito Scotiabank.
Descuentos no son acumulables con otras promociones y/o descuentos. ",Banco ScotiaBank
Inferno Burger De lunes a miércoles," No incluye costos de despacho.
El despacho y los tiempos del mismos son de exclusiva responsabilidad del comercio.
 Descuentos no son acumulables con otras promociones y/o descuentos. ",Banco ScotiaBank
Fundación Julieta De lunes a viernes," Válido de lunes a viernes.
Descuento no aplica sobre otros descuentos.
Pagando con tu Tarjeta de Débito y/o Crédito Scotia.
Descuento se hace efectivo en tiendas físicas anunciando medio de pago Scotia antes de pagar en caja. Promoción válida hasta el 1 de julio de 2025. promoción consiste en hasta 15% Dcto. en servicios de centro veterinario Fundación Julieta. Válido de lunes a viernes. Descuento no aplica sobre otros descuentos. Pagando con tu Tarjeta de Débito y/o Crédito Scotia. Descuento se hace efectivo en tiendas físicas anunciando medio de pago Scotia antes de pagar en caja. No acumulable con otras promociones. Se excluyen de esta promoción las Tarjetas Empresariales, Corporativas, Mastercard Business, Visa Business, Visa Enjoy, Visa Movistar, Visa Forum, Visa Congelada, Visa Crédito Express, Visa Bex y Tarjeta Universal, al igual que las Tarjetas de Crédito Cencosud Scotiabank, emitidas por su filial. El pago con tarjetas de crédito puede tener costos asociados. Consulta con el emisor de la tarjeta para mayor información.",Banco ScotiaBank
Clínica Maat Todos los días," Promoción no acumulable sobre otros descuentos.
Promoción exclusiva clientes pagando con Tarjetas de Scotiabank. Promoción válida todos los días hasta el 31 de diciembre 2025. Promoción consiste en hasta un 30% Dcto. en Clínica Maat para tratamientos de Radio Frecuencia, Cosmetología y Depilación (precio de lista). Además, accede a un 20% Dcto. en consultas médicas. Accede a estos beneficios anunciando en caja como código de descuento los primeros 6 dígitos de tu Tarjetas de Débito y Crédito Scotiabank. Promoción no acumulable sobre otras promociones o descuentos. Se excluyen de esta promoción las Tarjetas  Empresariales, Corporativas, Mastercard Business, Visa Business, Visa Enjoy, Visa Movistar, Visa Forum, Visa Congelada, Visa Crédito Express, Visa Bex y Tarjeta Universal, al igual que las Tarjetas de Crédito Cencosud Scotiabank, emitidas por su filial. El pago con tarjetas de crédito puede tener costos asociados. Consulta con el emisor de la tarjeta para mayor información.
 ",Banco ScotiaBank
Castor Watches Todos los días," Pagando con Tarjetas de Débito y/o Crédito Visa Scotiabank.
Descuento no acumulable sobre otras promocones o descuentos.
El despacho y los tiempos del mismo son de exclusiva responsabilidad del comercio. Promoción válida hasta el 31 de agosto de 2025. Promoción consiste en un 15% Dcto. en Castor Watches a través de www.castor-watches.com ingresando código de descuento SCOTIABANK15 y a continuación pagando con tus Tarjetas de Débito y/o Crédito Visa Scotiabank. El despacho y los tiempos del mismo son de exclusiva responsabilidad del comercio. Promoción no acumulable sobre otras promociones. Se excluyen de esta promoción las Tarjetas Empresariales, Corporativas, Mastercard Business, Visa Business, Visa Enjoy, Visa Movistar, Visa Forum, Visa Congelada, Visa Crédito Express, Visa Bex y Tarjeta Universal, al igual que las Tarjetas de Crédito Cencosud Scotiabank, emitidas por su filial. ",Banco ScotiaBank
Clínica Ambar De lunes a sábado,"  Promoción válida de lunes a sábado hasta el 30 de septiembre de 2025. Promoción consiste en un 20% de descuento en todas las prestaciones clínicas de odontología y estética facial. No incluye insumos: laboratorio, insumos de Cirugía Oral - Ortodoncia - Estética Facial. No acumulable sobre otros descuentos. Promoción exclusiva para los clientes del Scotia. Pagando con tus Tarjetas de Bébito o Crédito Visa Scotia. Se excluyen de esta promoción las Tarjetas Empresariales, Corporativas, Mastercard Business, Visa Business, Visa Enjoy, Visa Movistar, Visa Forum, Visa Congelada, Visa Crédito Express, Visa Bex, Tarjeta Universal y Tarjeta de Crédito Scotia Wealth Management, al igual que las Tarjetas de Crédito Cencosud Scotiabank, emitidas por su filial.",Banco ScotiaBank
La Boutique Dental  Todos los días," Promoción exclusiva para los clientes del Scotiabank.
Descuento se hace efectivo anunciado método de pago Scotiabank en caja.
No acumulable con otras promociones y descuentos.  Promoción válida hasta el 31 de diciembre de 2025. Promoción consiste en hasta un 50% de descuento en Clínica La Boutique Dental. 50% de descuento en: Evaluación inicial, Destartraje (limpieza dental) y aplicación de flúor. Incluye estudio con escáner intraoral para diagnóstico completo de salud bucal. Blanqueamiento Dental Philips Zoom (se exceptúa costo de insumo) El Blanqueamiento Philips Zoom aclara más tonos que otros blanqueamientos en una sola sesión y con menos sensibilidad post tratamiento. Evaluación de Odontopediatría, asesoría de salud bucal para padres, profilaxis (limpieza) y aplicación de flúor. 20% de descuento en: Rehabilitación Oral, Implantología, Ortodoncia (con Brackets y Alineadores invisibles), Odontopediatría, Periodoncia, Endodoncia, Trastornos Témporomandibualres, Cirugía, Estética Dental con Carillas Cerámicas y de Resina Compuesta. Exceptúa: Costos de Insumos (implantes, aditamentos para rehabilitación de implantes, pabellón, laboratorio dental). Tratamientos de armonización facial. (Exceptúa costos de insumos).  Promoción exclusiva para clientes Scotia. Descuento se hace efectivo anunciado método de pago Scotia en caja. No acumulable con otras promociones y descuentos. Se excluyen de esta promoción las Tarjetas Empresariales, Corporativas, Mastercard Business, Visa Business, Visa Enjoy, Visa Movistar, Visa Forum, Visa Congelada, Visa Crédito Express, Visa Bex y Tarjeta Universal, Tarjeta de Crédito Scotia Wealth Management, al igual que las Tarjetas de Crédito Cencosud Scotiabank, emitidas por su filial.",Banco ScotiaBank
Clínica Ampuero Todos los días,"  Promoción consiste en un 20% de descuento de bonificaión del Arancel de Clínica Ampuero (se exceptúan los costos de laboratorio). 2 años de garantía en todos los tratamientos dentales (Excepto Periodoncia y Odontopediatría) Facilidades de pago 100% Cobertura en Diagnóstico e Interconsultas 80% Cobertura en Radiografías. 40 % de Descuento en acciones de Armonización Orofacial (se exceptuan costos de insumos): Toxina Botulínica (Botox - Nabota) Ácido Hialurónico (Neauvia - Restylane) Rinomodelación - Lifting Facial - Labios - Surco Nasogeniano - Contorno Mandibular - Mentón - Ojeras. Mesoterapia Facial (Pink Glow - Fusion) Skinbooster (Neauvia) Hilos Tensores Hilos Revitalizantes Mallas de Suspensión (Tesslift) Lipopapada enzimatica. Descuento de caracter presencial anunciando método de pago con tarjetas Scotia en caja. Se excluyen de esta promoción las Tarjetas Empresariales, Corporativas, Mastercard Business, Visa Business, Visa Enjoy, Visa Movistar, Visa Forum, Visa Congelada, Visa Crédito Express, Visa Bex y Tarjeta Universal, Tarjeta de Crédito Scotia Wealth Management, al igual que las Tarjetas de Crédito Cencosud Scotiabank, emitidas por su filial.",Banco ScotiaBank
Hellowine Todos los días," El despacho y los tiempos del mismo son de exclusiva responsabilidad del comercio.
Promoción no acumulable con otras promociones o descuentos. ",Banco ScotiaBank
Lovet Todos los días, Descuento no acumulable con otros descuentos o promociones. ,Banco ScotiaBank
Academia Andrés Díaz Todos los días," Descuentos disponibles en modalidad 1 día en cualquiera de las sedes.
Máximo 2 cupones con descuento por Tarjeta de Crédito.
El cupón se genera ingresando los dígitos de la Tarjeta de Crédito que se indique en la casilla correspondiente. Beneficio válido hasta el 01 de noviembre de 2025 o hasta agotar fondo promocional de $12.000000, lo que ocurra primero. Promoción consiste en un 20% Dcto. en la inscripción trimestral o anual en la Academia Andrés Diaz, pagando con las Tarjetas Visa Scotiabank Singular o Infinite. Descuentos disponibles en modalidad 1 día en cualquiera de las sedes. Máximo 2 cupones con descuento por Tarjeta de Crédito. El cupón se genera ingresando los dígitos de la Tarjeta de Crédito que se indique en la casilla correspondiente. Las ofertas, ventas y descuentos, entregas de beneficios no financieros, como asimismo la garantía, servicio y calidad del producto será de exclusiva responsabilidad del comercio adherido a la promoción, sin responsabilidad ni injerencia alguna para Scotiabank ni en la ulterior atención que ello demande. Infórmese sobre la garantía estatal de los depósitos en su banco o en www.cmfchile.cl. Marca registrada de The Bank of Nova Scotia, utilizada bajo licencia. Productos excluidos de la promoción: Selección Elite, Winter Camp, Summer Camp e indumentaria.",Banco ScotiaBank
Cliniestetique Todos los días," Promoción no acumulable sobre otras promociones o descuentos. Promoción válida hasta el 31 de diciembre de 2025. Promoción consiste en  un 30% Dcto. en Centro de estética integral Estetique, tratamientos reductivos, masajes corporales, limpiezas facial, dermapen, ácido hialuronico, botox y armonización facial. Descuento válido anunciando método de pago Scotiabank en caja, indicando los primeros 6 números de la Tarjeta de Crédito o Débito Scotiabank como código de descuento. No acumulable sobre otras promociones o descuentos. Promoción exclusiva para los clientes Scotiabank. Se excluyen de esta promoción las Tarjetas Empresariales, Corporativas, Mastercard Business, Visa Business, Visa Enjoy, Visa Movistar, Visa Forum, Visa Congelada,Visa  Crédito Express, Visa Bex y Tarjeta Universal, al igual que las Tarjetas de Crédito Cencosud Scotiabank, emitidas por su filial. El pago con tarjetas de crédito puede tener costos asociados. Consulta con el emisor de la tarjeta para mayor información.",Banco ScotiaBank
AC Odontología Todos los días," Promoción exclusiva para los clientes del Scotia.
Descuento se hace efectivo anunciado método de pago Scotia en caja.
No acumulable con otras promociones y descuentos.  Promoción válida hasta el 31 de diciembre de 2025. Promoción consiste en un 50% de descuento en todas las prestaciones clínicas odontológicas del arancel en AC Odontología. No incluye costos externos de: laboratorio dental, insumos de Implantología Oral - Ortodoncia, Servicios de imagenología 3D, derechos de pabellón y sedación médica. Promoción exclusiva para clientes Scotia. Descuento se hace efectivo anunciado método de pago Scotia en caja. No acumulable con otras promociones y descuentos. Se excluyen de esta promoción las Tarjetas Empresariales, Corporativas, Mastercard Business, Visa Business, Visa Enjoy, Visa Movistar, Visa Forum, Visa Congelada, Visa Crédito Express, Visa Bex y Tarjeta Universal, Tarjeta de Crédito Scotia Wealth Management, al igual que las Tarjetas de Crédito Cencosud Scotiabank, emitidas por su filial.",Banco ScotiaBank
Dily Todos los días,"  Promoción válida hasta el 30 de septiembre de 2025. Promoción consiste en un 30% Dcto. en el servicio de tranferencia de dominio digital en el sitio web de Dily. Pagando con Tarjetas de Crédito o Débito Scotiabank ingresando como código de descuento los seis primeros números. Máximo 1 uso de cupón por cliente. El despacho y los tiempos del mismo son de exclusiva responsabilidad del comercio. Promoción no acumulable con otras promociones. Se excluyen de esta promoción las Tarjetas Empresariales, Corporativas, Mastercard Business, Visa Business, Visa Enjoy, Visa Movistar, Visa Forum, Visa Congelada, Visa Crédito Express, Visa BEX, Tarjeta Universal, al igual que las Tarjetas de Crédito Cencosud Scotiabank, emitidas por su filial. El pago con Tarjeta de Crédito puede tener costos asociados. Consulta con el emisor de la tarjeta para mayor información. ",Banco ScotiaBank
Mr. Smashed Todos los días," No acumulable sobre otras promociones o descuentos. 
Promoción exclusiva para clientes Scotiabank. Promoción válida todos los días de marzo 2025. Promocón consiste en un 20% de descuento en compras presenciales Mr. Smashed anunciado método de pago Scotia en caja. No acumulable sobre otras promociones o descuentos. Promoción exclusiva para clientes Scotia. El despacho y los tiempos del mismo son de exclusiva responsabilidad del comercio. Se excluyen de esta promoción las Tarjetas  Empresariales, Corporativas, Mastercard Business, Visa Business, Visa Enjoy, Visa Movistar, Visa Forum, Visa Congelada, Visa Crédito Express, Visa Bex y Tarjeta Universal, al igual que las Tarjetas de Crédito Cencosud Scotiabank, emitidas por su filial. El pago con tarjetas de crédito puede tener costos asociados. Consulta con el emisor de la tarjeta para mayor información.",Banco ScotiaBank
Mr. Wrap Todos los días," No acumulable sobre otras promociones o descuentos. 
Promoción exclusiva para clientes Scotia. Promoción válida todos los días de  marzo 2025. promocón consiste en un 20% de descuento en compras presenciales Mr. Wrap anunciado método de pago Scotia en caja. No acumulable sobre otras promociones o descuentos. Promoción exclusiva para clientes Scotia. El despacho y los tiempos del mismo son de exclusiva responsabilidad del comercio. Se excluyen de esta promoción las Tarjetas  Empresariales, Corporativas, Mastercard Business, Visa Business, Visa Enjoy, Visa Movistar, Visa Forum, Visa Congelada, Visa Crédito Express, Visa Bex y Tarjeta Universal, al igual que las Tarjetas de Crédito Cencosud Scotiabank, emitidas por su filial. El pago con tarjetas de crédito puede tener costos asociados. Consulta con el emisor de la tarjeta para mayor información.",Banco ScotiaBank
Vietcoffee Todos los días," Pagando con tus Tarjetas de Cédito o Débito Visa Scotia. 
El despacho y los tiempos del mismo son de exclusiva responsabilidad del comercio.
Promoción no acumulable con otras promociones. Promoción válida hasta el 23 de agosto de 2025. Promoción consiste en un 20% descuento en compras a través de https://www.vietcoffee.net Ingresando Código de descuento SCOTIABANK20 y pagando con tus Tarjetas de Cédito o Débito Visa Scotia. El despacho y los tiempos del mismo son de exclusiva responsabilidad del comercio. Promoción no acumulable con otras promociones. Se excluyen de esta promoción las Tarjetas Empresariales, Corporativas, Mastercard Business, Visa Business, Visa Enjoy, Visa Movistar, Visa Forum, Visa Congelada, Visa Crédito Express, Visa Bex, Tarjeta Universal y Tarjeta de Crédito Scotia Wealth Management, al igual que las Tarjetas de Crédito Cencosud Scotiabank, emitidas por su filial.",Banco ScotiaBank
Kinexpert Todos los días," No acumulable sobre otros descuentos.
Promoción exclusiva para los clientes Scotia.  ",Banco ScotiaBank
Zink Chile Todos los días," El despacho y los tiempos del mismo son de exclusiva responsabilidad del comercio.
Promoción no acumulable con otras promociones. ",Banco ScotiaBank
Invermoto Todos los días,"  Promoción válida hasta el 31 de diciembre de 2025. Promoción consiste en hasta un 30% Dcto. en tiendas Invermoto. 30% Dcto. en compra de botella de lubricante para las marcas Honda, Ipone, Máxima, Yamalube, tope de $100.000 con un máximo de 4 botellas de lubricantes al mes. 30% Dcto. en cascos para marcas Shoei, AGV, HJC, AXXIS, Shaft, Arai, HRO con tope de un casco al mes. 25% Dcto. en compra de repuestos para marcas Honda, Yamaha, Suzuki, Royal, Enfield con tope de $100.000 por cliente titular. 20% Dcto. en compra presencial para accesorios de todas las marcas en tiendas Invermoto con tope de $200.000 por cliente titular. 10% Dcto. en servicios de taller para todas las marcas con tope de $50.000 al mes. Beneficio aplicable sólo para compras a precio de lista y no acumulable con otras promociones, ofertas, regalos o descuentos. Accede a este beneficio anunciando método de pago Scotiabank e indicando los primeros 6 números de la Tarjeta como código de descuento. Descuento exclusivo pagando con Tarjetas de Débito o Crédito Scotiabank. Exclusivo para clientes titulares que realicen compras presenciales en tiendas Invermoto ubicadas en Francisco Bilbao 1102, y Francisco Bilbao 1134, Local Blue Bikes, Providencia. Avenida Vicuña Mackenna Poniente 7387, La Florida. Los topes y descuentos son de exclusiva responsabilidad del comercio. Se excluyen de esta promoción las Tarjetas Empresariales, Corporativas, Mastercard Business, Visa Business, Visa Enjoy, Visa Movistar, Visa Forum, Visa Congelada, Visa Crédito Express, Visa BEX, Tarjeta Universal, al igual que las Tarjetas de Crédito Cencosud Scotiabank, emitidas por su filial. El pago con tarjeta de crédito puede tener costos asociados. Consulta con el emisor de la tarjeta para mayor información.",Banco ScotiaBank
Poliglota Todos los días," No acumulable sobre otras promociones, descuentos o eventos especiales como CyberDays, Cyber Monday, Black Friday u otras fechas designadas como eventos promocionales.
No válido en promociones especiales como Oferta Flash.
Un uso de cupón por cliente. 
Exclusivo para clientes Scotiabank. Promoción válida todos los días hasta el 30 de marzo de 2026. Promoción consiste en hasta 76% Dcto. en cursos de idiomas (Inglés, Portugués, Francés, Alemán e Italiano) a través de www.poliglota.org/cl/promos/scotia. Válido para contrataciones entre 6, 12 o 18 meses de acceso a 59% Dcto. en plan grupal 6 meses. 68% Dcto. en plan grupal 12 meses. 76% Dcto. en plan grupal 18 meses. Descuento exclusivo pagando con tus Tarjetas de Débito o Crédito Scotiabank. Ingresando como código de descuento los primero 6 dígitos de la Tarjeta Scotiabank. No acumulable sobre otras promociones, descuentos o eventos especiales como CyberDays, Cyber Monday, Black Friday u otras fechas designadas como eventos promocionales. No válido en promociones especiales como Oferta Flash. Un uso de cupón por cliente. Se excluyen de esta promoción las Tarjetas Empresariales, Corporativas, Mastercard Business, Visa Business, Visa Enjoy, Visa Movistar, Visa Forum, Visa Congelada, Visa Crédito Express, Visa Bex y Tarjeta Universal, al igual que las Tarjetas de Crédito Cencosud Scotiabank, emitidas por su filial. El pago con tarjetas de crédito puede tener costos asociados. Consulta con el emisor de la tarjeta para mayor información.",Banco ScotiaBank
