Elemento,Descripcion,Banco
Calyptra Todos los jueves," Descuento aplica sobre precio normal.
Máximo 1 uso de cupón por cliente.
El despacho y los tiempos del mismo son de exclusiva responsabilidad del comercio.
Excluye packs y vinos Argentinos.
Promoción no acumulable con otras promociones o descuentos. ",Banco ScotiaBank
Bigbox Todos los días," La oferta es de exclusiva responsabilidad del comercio.
No acumulable con otras ofertas y/o promociones.
Beneficio solo para compras online. Promoción válida todos los días de marzo de 2025. Promoción consiste en un 10% Dcto. en categoría Aventura a través de www.bigbox.cl. Accede a este beneficio ingresando como código de descuento los 6 primeros digitos de tus Tarjetas de Débito y Crédito Visa Scotiabank. La oferta es de exclusiva responsabilidad del comercio. No acumulable con otras ofertas y/o promociones. Beneficio solo para compras online. Se excluyen de esta promoción las Tarjetas Empresariales, Corporativas, Mastercard Business, Visa Business, Visa Enjoy, Visa Movistar, Visa Forum, Visa Congelada, Visa Crédito Express, Visa Bex y Tarjeta Universal, al igual que las Tarjetas de Crédito Cencosud Scotiabank, emitidas por su filial. El pago con tarjetas de crédito puede tener costos asociados. Consulta con el emisor de la tarjeta para mayor información.",Banco ScotiaBank
Geofoods Todos los días," Los costos del despacho y los tiempos del mismo son exclusiva responsabilidad del comercio.
Beneficio exclusivo para clientes Scotia.
Pagando con Tarjetas de Débito o Crédito Scotiabank. Promoción válida todos los dias de marzo 2025. Promoción consiste en 20% de descuento adicional en tienda online https://geofoods.cl. Pagando con Tarjetas de Crédito y/o Débito Scotia e ingresando cupón de descuento SCTGF2024. El despacho y los tiempos del mismo son de exclusiva responsabilidad del comercio. Promoción no acumulable con otras promociones ni sobre el costo del despacho. Se excluyen de esta promoción las Tarjetas  Empresariales, Corporativas, Mastercard Business, Visa Business, Visa Enjoy, Visa Movistar, Visa Forum, Visa Congelada, Visa Crédito Express, Visa Bex y Tarjeta Universal, al igual que las Tarjetas de Crédito Cencosud Scotiabank, emitidas por su filial. El pago con tarjetas de crédito puede tener costos asociados. Consulta con el emisor de la tarjeta para mayor información.",Banco ScotiaBank
Mercado Carozzi Todos los días," No considera accesorios y packs.
Beneficio no es acumulable con otras promociones o descuentos.
El despacho y los tiempos del mismo son de exclusiva responsabilidad del comercio.
Para acceder al beneficio cliente debe ingresar y registrarse a través del link www.mercadocarozzi.cl/amigos-carozzi dentro del Grupo Beneficio correspondiente “Banco Scotiabank” de lo contrario no podrá visualizar el descuento. Promoción válida todos los días de marzo de 2025. Promoción consiste en desde 20% Dcto. en www.mercadocarozzi.cl. Promoción no considera accesorios y packs. Promoción no acumulable con otras promociones o descuentos. El despacho y los tiempos del mismo son de exclusiva responsabilidad del comercio. Para acceder al beneficio cliente debe registrarse a través del link www.mercadocarozzi.cl/amigos-carozzi, colocar toda la información que el formulario solicita y registrarse dentro del Grupo Beneficio correspondiente “Banco Scotiabank”. A continuación navegando como registrado podrás acceder directamente a los precios oferta. Se excluyen de esta promoción las Tarjetas Empresariales, Corporativas, Mastercard Business, Visa Business, Visa Enjoy, Visa Movistar, Visa Forum, Visa Congelada, Visa Crédito Express, Visa Bex y Tarjeta Universal, al igual que las Tarjetas de Crédito Cencosud Scotiabank, emitidas por su filial. El pago con tarjetas de crédito puede tener costos asociados. Consulta con el emisor de la tarjeta para más información.",Banco ScotiaBank
Eco Car Todos los días," Promoción válida para servicios presenciales en Sucursales Las Condes ubicadas en Los Militares 5890, Estoril 50, Estoril 200 y Lo Fontecilla 101.
Descuento no acumulable sobre otras promociones o descuentos. Promoción válida hasta el 30 de septiembre de 2025. Promoción consiste en un 30% Dcto. en Eco Car en todos los servicios de lavado de vehículos y extras: Lavado de tapiz, lavado de alfombra, lavado de laterales, lavado de techo, full integral, pulido por pieza, pulido completo, pulido de focos (por unidad y ambos focos), pulido de llanta (por unidad o total llantas), grabado de patente (por unidad) y grabado de accesorios. Accede a estos beneficios reservando a través del sitio web www.lavadoecocar.cl e indicando los primeros 6 dígitos de tus Tarjetas de Débito o Crédito Scotiabank como código de descuento. Promoción válida para servicios presenciales en Sucursales Las Condes ubicadas en Los Militares 5890, Estoril 50, Estoril 200 y Lo Fontecilla 101. Descuento no acumulable sobre otras promociones o descuentos. Se excluyen de esta promoción las Tarjetas Empresariales, Corporativas, Mastercard Business, Visa Business, Visa Enjoy, Visa Movistar, Visa Forum, Visa Congelada, Visa Crédito Express, Visa Bex y Tarjeta Universal, al igual que las Tarjetas de Crédito Cencosud Scotiabank, emitidas por su filial. ",Banco ScotiaBank
Pompeyo Carrasco Todos los días," Descuento no aplica sobre otras promociones o descuentos.
Exclusivo para clientes Scotia.  ",Banco ScotiaBank
Importclick Todos los días," Promoción exclusiva para clientes Scotiabank.
Excluye cyber.
El despacho y los tiempos del mismo son de exclusiva responsabilidad del comercio. 
  Promoción válida todos los días de marzo de 2025. Promoción consiste en un 30% Dcto. sobre los descuentos ya activos en tienda online www.importclick.cl. Todos los días ingresando código de descuento IMPORTSCOTIA. Pagando con Tarjetas de Crédito y/o Débito Scotiabank. No acumulable sobre otras promociones o descuentos. Promoción exclusiva para clientes Scotia. Excluye cyber. El despacho y los tiempos del mismo son de exclusiva responsabilidad del comercio. Se excluyen de esta promoción las Tarjetas  Empresariales, Corporativas, Mastercard Business, Visa Business, Visa Enjoy, Visa Movistar, Visa Forum, Visa Congelada, Visa Crédito Express, Visa Bex y Tarjeta Universal, al igual que las Tarjetas de Crédito Cencosud Scotiabank, emitidas por su filial. El pago con tarjetas de crédito puede tener costos asociados. Consulta con el emisor de la tarjeta para mayor información.",Banco ScotiaBank
AutoExpertos Todos los días,"  Promoción válida todos los días de marzo de 2025. Promoción consiste en un 20% Dcto. en todos los servicios automotrices agendados a través de https://www.autoexpertos.cl/partnerships/scotia pagando con Tarjetas de Débito o Crédito Scotiabank y presentando código de descuento SCOTIACLUB previo al pago. Descuento no aplica sobre otras promociones o descuentos. Descuento no aplica sobre la venta de neumáticos. El valor del descuento tiene un tope de $150.000 Tampoco se aplica sobre servicios adicionales a los contratados inicialmente. Descuento no aplica sobre costo de despacho. El despacho y los tiempos del mismo son de exclusiva responsabilidad del comercio. Se excluyen de esta promoción las Tarjetas Empresariales, Corporativas, Mastercard Business, Visa Business, Visa Enjoy, Visa Movistar, Visa Forum, Visa Congelada, Visa Crédito Express, Visa BEX, Tarjeta Universal, al igual que las Tarjetas de Crédito Cencosud Scotiabank, emitidas por su filial. El pago con tarjeta de crédito puede tener costos asociados. Consulta con el emisor de la tarjeta para mayor información.",Banco ScotiaBank
Lanzamiento Samsung Galaxy S25 Todos los días," El descuento se realiza al momento de la compra, ingresando los 6 primeros dígitos de la Tarjeta como código de descuento y pagando con tus Tarjetas de Crédito Scotiabank Signature, Singular, Infinite y Wealth a través de Mercado Pago
El costo del despacho y los tiempos del mismo son de exclusiva responsabilidad del comercio.
Descuento no acumulable sobre otras promociones o descuentos. ",Banco ScotiaBank
Tierra de Frutos Todos los días," No acumulable sobre otras promociones o descuentos. 
Promoción exclusiva para clientes Scotiabank.
El despacho y los tiempos del mismo son de exclusiva responsabilidad del comercio. Promoción válida hasta el 31 de diciembre de 2025. Promoción consiste en 20% de descuento en tienda online www.tierradefrutos.cl,  ingresando cupón de descuento SCOTIABANK2024. Pagando con tus Tarjetas de Débito o Crédito Scotiabank. No acumulable sobre otras promociones o descuentos. Promoción exclusiva para clientes Scotia. El despacho y los tiempos del mismo son de exclusiva responsabilidad del comercio. Se excluyen de esta promoción las Tarjetas  Empresariales, Corporativas, Mastercard Business, Visa Business, Visa Enjoy, Visa Movistar, Visa Forum, Visa Congelada, Visa Crédito Express, Visa Bex y Tarjeta Universal, al igual que las Tarjetas de Crédito Cencosud Scotiabank, emitidas por su filial. El pago con tarjetas de crédito puede tener costos asociados. Consulta con el emisor de la tarjeta para mayor información.",Banco ScotiaBank
Florde Todos los días," No acumulable sobre otras promociones o descuentos. 
Promoción exclusiva para clientes Scotia.
El despacho y los tiempos del mismo son de exclusiva responsabilidad del comercio.
Exclusivo Región Metropolitana. Promoción válida hasta el 30 de agosto de 2025. Promoción consiste en un 20% Dcto. todos los días en ingresando como código de descuento SCOTIABANK. No acumulable sobre otras promociones o descuentos. Promoción exclusiva pagando con Tarjetas de Débito o Crédito Scotiabank. Exclusivo para Región Metropolitana. El despacho y los tiempos del mismo son de exclusiva responsabilidad del comercio. Descuento no acumulable sobre otras promociones o descuentos. Se excluyen de esta promoción las Tarjetas  Empresariales, Corporativas, Mastercard Business, Visa Business, Visa Enjoy, Visa Movistar, Visa Forum, Visa Congelada, Visa Crédito Express, Visa Bex y Tarjeta Universal, al igual que las Tarjetas de Crédito Cencosud Scotiabank, emitidas por su filial. El pago con tarjetas de crédito puede tener costos asociados. Consulta con el emisor de la tarjeta para mayor información.",Banco ScotiaBank
Vigfor Todos los viernes," Promoción no acumulable sobre otras promociones o descuentos.
El despacho y los tiempos del mismo son de exclusiva responsabilidad del comercio. Promoción válida todos los viernes hasta el 31 de marzo 2025. Promoción consiste en un 25% Dcto. en el total de la compra para repuestos originales o alternativos en sucursales de Vigfor: Santiago, Antofagasta, Coquimbo, Viña del Mar, Concepción, Los Ángeles y Puerto Montt, a continuación, pagando con tus Tarjetas de Débito o Crédito Visa Scotiabank. Promoción no acumulable sobre otras promociones o descuentos. El despacho y los tiempos del mismo son de exclusiva responsabilidad del comercio. Exclusivo para compra presencial anunciando método de pago Scotiabank. Se excluyen de esta promoción las Tarjetas Empresariales, Corporativas, Mastercard Business, Visa Business, Visa Enjoy, Visa Movistar, Visa Forum, Visa Congelada, Visa Crédito Express, Visa BEX, Tarjeta Universal, al igual que las Tarjetas de Crédito Cencosud Scotiabank, emitidas por su filial. El pago con tarjeta de crédito puede tener costos asociados. Consulta con el emisor de la tarjeta para mayor información.",Banco ScotiaBank
Surface Todos los días," Promoción no acumulable sobre otras promociones, ni sobre el costo del despacho. Promoción válida hasta el 30 de abril de 2025. Promoción consiste en un 15% Dcto. en todos los modelos de Surface https://surface604.cl/. Accede a este descuento pagando con tus Tarjetas de Débito o Crédito Scotiabank e ingresando el código de descuento: SCOTIABANK15. Promoción exclusiva para clientes Scotiabank. Promoción no acumulable sobre otras promociones, ni sobre el costo del despacho. Se excluyen de esta promoción las Tarjetas Empresariales, Corporativas, Mastercard Business, Visa Business, Visa Enjoy, Visa Movistar, Visa Forum, Visa Congelada, Visa Crédito Express, Visa Bex y Tarjeta Universal, al igual que las Tarjetas de Crédito Cencosud Scotiabank, emitidas por su filial.",Banco ScotiaBank
Dr. Smile Todos los días," Descuento no aplica en costos de laboratorio ni pabellón.
No acumulable sobre otras promociones y/o descuentos.
Promoción exclusiva para los clientes del Scotiabank. Pormoción válida todos los días hasta el 31 de agosto de 2025. Promoción consiste en un 20% Dcto. sobre el arancel real en todas las prestaciones de la clínica Dr Smile. Pagando y anunciando los primeros 6 números tus Tarjetas de Débito o Crédito Scotiabank en caja. Válido para sucursal Egaña (Av Ossa 235- Local 135, La Reina) o sucursal, Encomenderos (Encomenderos 138, Las Condes). Descuento no aplica en costos de laboratorio ni pabellón. No acumulable sobre otras promociones y/o descuentos. Promoción exclusiva para los clientes Scotiabank. Se excluyen de esta promoción las Tarjetas Empresariales, Corporativas, Mastercard Business, Visa Business, Visa Enjoy, Visa Movistar, Visa Forum, Visa Congelada, Visa Crédito Express, Visa Bex y Tarjeta Universal, Tarjeta de Crédito Scotia Wealth Management, al igual que las Tarjetas de Crédito Cencosud Scotiabank, emitidas por su filial.",Banco ScotiaBank
Nikola Todos los días,"  Promoción válida hasta el 31 de marzo de 2025. Promoción consiste en un 5% Dcto. en Nikola. Accede a este beneficio anunciando método de pago Scotiabank con tu ejecutivo y a continuación pagando con tus Tarjetas de Crédito Visa Scotiabank Signature, Infinite, Singular y Wealth Management. Promoción no acumulable sobre otras promociones. El despacho y los tiempos del mismo son de exclusiva responsabilidad del comercio. Promoción exclusiva para clientes Scotiabank. Se excluyen de esta promoción las Tarjetas de Débito Scotia, Tarjetas de Crédito Visa y Mastercard Scotia Gold, Platinum, Mastercard Black, Tarjetas Empresariales, Corporativas, Mastercard Business, Visa Business, Visa Enjoy, Visa Movistar, Visa Forum, Visa Congelada, Visa Crédito Express, Visa Bex y Tarjeta Universal, al igual que las Tarjetas de Crédito Cencosud Scotiabank, emitidas por su filial. El pago con tarjetas de crédito puede tener costos asociados. Consulta con el emisor de la tarjeta para mayor información.",Banco ScotiaBank
Warmtec Todos los días," Promoción exclusiva clientes Scotiabank. 
Promoción no acumulable sobre otros descuentos o promociones.  Promoción válida hasta el 30 de junio de 2026. Promoción consiste en un 20% de descuento sobre el valor neto de provisión e instalación del sistema de calefacción de piso radiante eléctrico infrarrojo coreano que vende e instala Warmtec. para acceder al beneficio ingresa a  www.warmtec.cl escribe contacto@warmtec.cl o llama al siguiente número de teléfono +56989058797 solicitando la instalación y cotización, para obtener el descuento se debe anunciar método de pago Scotia e indicar los primeros 6  primeros dígitos de tus Tarjetas de Débito o Crédito Visa Scotia cómo código de descuento.  Promoción exclusiva clientes Scotia. Promoción no acumulable sobre otros descuentos. Se excluyen de esta promoción las Tarjetas Empresariales, Corporativas, Mastercard Business, Visa Business, Visa Enjoy, Visa Movistar, Visa Forum, Visa Congelada, Visa Crédito Express, Visa Bex y Tarjeta Universal, al igual que las Tarjetas de Crédito Cencosud Scotiabank, emitidas por su filial. El pago con tarjetas de crédito puede tener costos asociados. Consulta con el emisor de la tarjeta para mayor información.",Banco ScotiaBank
Panorama Lumon Todos los días," No acumulable sobre otros descuentos.
Promoción exclusiva para los clientes Scotia.
Descuento válido solo para cortinas de cristal que contraten el Formas de pago: al contado o hasta 12 cuotas con tarjeta de crédito.
Descuento aplica para cortinas de cristal superiores a 3 metros lineales, no aplica para otras cortinas. Promoción consiste en un 10% Dcto. en cierres de terrazas de cristal a través de www.panoramachile.cl. Promoción válida hasta el 30 de abril de 2026. Descuento se hace efectivo anunciando método de pago Scotiabank en caja. Promoción exclusiva pagando con Tarjetas de Débito o Crédito Scotiabank. Promoción no acumulable sobre otras promociones o descuentos. Descuento válido solo para cortinas de cristal que contraten el Formas de pago: al contado o hasta 12 cuotas con Tarjeta de Crédito Scotiabank. Promoción aplica para cortinas de cristal superiores a 3 metros lineales, no aplica para otras cortinas. Se excluyen de esta promoción las Tarjetas Empresariales, Corporativas, Mastercard Business, Visa Business, Visa Enjoy, Visa Movistar, Visa Forum, Visa Congelada, Visa Crédito Express, Visa Bex y Tarjeta Universal, al igual que las Tarjetas de Crédito Cencosud Scotiabank, emitidas por su filial. El pago con tarjetas de crédito puede tener costos asociados. Consulta con el emisor de la tarjeta para mayor información.",Banco ScotiaBank
Insanity Bikes Todos los días,"  Promoción válida todos los días de marzo de 2025. Promoción consiste en un hasta 30% Dcto. en Insanity Bikes exclusivo para compra presencial. Accede a un 30% Dcto. en zapatillas modelo Rekon1, un 25% Dcto. en Accesorios seleccionados, un 20% Dcto. en servicio de mantenciones de taller mecánico, un 10% Dcto. en bicicletas multimarcas para compras en tienda fisíca y un 5% Dcto. para bicicletas multimarcas. Accede a este beneficio anunciando como código de descuento los 6 primeros dígitos de tus Tarjetas de Débito y Crédito Scotiabank. Promoción exclusiva para clientes Scotiabank. Descuento no acumulable sobre otras promociones o descuentos. Se excluyen de esta promoción las Tarjetas Empresariales, Corporativas, Mastercard Business, Visa Business, Visa Enjoy, Visa Movistar, Visa Forum, Visa Congelada, Visa Crédito Express, Visa Bex y Tarjeta Universal, al igual que las Tarjetas de Crédito Cencosud Scotiabank, emitidas por su filial. ",Banco ScotiaBank
Smart Cargo Todos los días," No acumulable con otras promociones o descuentos.
Exclusivo para clientes Scotia. Promoción válida todos los días de marzo de 2025. Promoción consiste en hasta un 15% Dcto. en Smart Cargo Electromovilidad. Accede a un 5% Dcto. en Vehículos eléctricos Smart Cargo y a un 15% Dcto. en repuestos o servicios Smart Cargo. Accede a este beneficio pagando con Tarjetas de Débito y Crédito Scotiabank y anunciando cómo código de descuento los 6 primeros dígitos de tus Tarjetas. No incluye costos de despacho. No acumulable con otras promociones o descuentos. Exclusivo para clientes Scotia. Se excluyen de esta promoción las Tarjetas Empresariales, Corporativas, Mastercard Business, Visa Business, Visa Enjoy, Visa Movistar, Visa Forum, Visa Congelada, Visa Crédito Express, Visa BEX, Tarjeta Universal, al igual que las Tarjetas de Crédito Cencosud Scotiabank, emitidas por su filial. El pago con tarjeta de crédito puede tener costos asociados. Consulta con el emisor de la tarjeta para mayor información.",Banco ScotiaBank
Zero Water Todos los días," Descuento no aplica sobre otras promociones o descuentos.
Descuento no aplica sobre costo de despacho.
El despacho y los tiempos del mismo son de exclusiva responsabilidad del comercio.  Promoción válida todos los días hasta el 31 de julio de 2025. Beneficio consiste en dos meses de Zero Water sin costo contratando durante marzo e inscribiendo Scotiabank cómo método de pago. Accede a este beneficio inscribiendo cómo método de pago tus Tarjetas de Débito y Crédito Scotiabank. Contrata tu plan llamando al +562 27148752. Descuento no aplica sobre otras promociones o descuentos. Descuento no aplica sobre costo de despacho. El despacho y los tiempos del mismo son de exclusiva responsabilidad del comercio. Se excluyen de esta promoción las Tarjetas Empresariales, Corporativas, Mastercard Business, Visa Business, Visa Enjoy, Visa Movistar, Visa Forum, Visa Congelada, Visa Crédito Express, Visa Bex y Tarjeta Universal, al igual que las Tarjetas de Crédito Cencosud Scotiabank, emitidas por su filial. El pago con tarjetas de crédito puede tener costos asociados. Consulta con el emisor de la tarjeta para mayor información.",Banco ScotiaBank
Tefal Todos los días," El despacho y los tiempos del mismo son de exclusiva responsabilidad del comercio.
Promoción no acumulable con otras promociones, ni sobre el costo del despacho. Promoción válida hasta el 31 de marzo de 2025. Promoción consiste en un 30% Dcto. en tienda online www.tefalstore.cl. No aplica tope de descuento por cliente titular. Accede a este beneficio pagando con tus Tarjetas de Débito y/o Crédito Scotiabank e ingresando código de descuento: SCOTIASEB24. El despacho y los tiempos del mismo son de exclusiva responsabilidad del comercio. Promoción no acumulable sobre otras promociones, ni sobre el costo del despacho. Se excluyen de esta promoción las Tarjetas Empresariales, Corporativas, Mastercard Business, Visa Business, Visa Enjoy, Visa Movistar, Visa Forum, Visa Congelada, Visa Crédito Express, Visa Bex y Tarjeta Universal, al igual que las Tarjetas de Crédito Cencosud Scotiabank, emitidas por su filial.",Banco ScotiaBank
Rowenta Todos los días," El despacho y los tiempos del mismo son de exclusiva responsabilidad del comercio.
Promoción no acumulable con otras promociones, ni sobre el costo del despacho. Promoción válida todos los días de marzo de 2025. Promoción consiste en un 30% Dcto. en Rowenta a través de tienda online. No aplica tope de descuento por cliente titular. Descuento aplica pagando con Tarjetas de Débito y/o Crédito Scotiabank e ingresando código de descuento: SCOTIASEB24. El despacho y los tiempos del mismo son de exclusiva responsabilidad del comercio. Promoción no acumulable con otras promociones, ni sobre el costo del despacho. Se excluyen de esta promoción las Tarjetas Empresariales, Corporativas, Mastercard Business, Visa Business, Visa Enjoy, Visa Movistar, Visa Forum, Visa Congelada, Visa Crédito Express, Visa Bex y Tarjeta Universal, al igual que las Tarjetas de Crédito Cencosud Scotiabank, emitidas por su filial.",Banco ScotiaBank
Moulinex Todos los días," El despacho y los tiempos del mismo son de exclusiva responsabilidad del comercio.
Promoción no acumulable con otras promociones, ni sobre el costo del despacho. Promoción válida hasta el 31 de marzo de 2025. Promoción consiste en un 30% Dcto. en Moullinex a través de tienda online www.tefalstore.cl. Promoción sin tope de descuento por cliente titular. Descuento aplica pagando con Tarjetas de Débito y/o Crédito Scotiabank e ingresando código de descuento: SCOTIASEB24. El despacho y los tiempos del mismo son de exclusiva responsabilidad del comercio. Promoción no acumulable con otras promociones, ni sobre el costo del despacho. Se excluyen de esta promoción las Tarjetas Empresariales, Corporativas, Mastercard Business, Visa Business, Visa Enjoy, Visa Movistar, Visa Forum, Visa Congelada, Visa Crédito Express, Visa Bex y Tarjeta Universal, al igual que las Tarjetas de Crédito Cencosud Scotiabank, emitidas por su filial.",Banco ScotiaBank
Krups Todos los días," El despacho y los tiempos del mismo son de exclusiva responsabilidad del comercio.
Promoción no acumulable con otras promociones, ni sobre el costo del despacho. Promoción válida todos los días de marzo de 2025. Promoción consiste en un 30% Dcto. en tienda online www.tefalstore.cl. Descuento no aplica tope de descuento por cliente titular. Descuento aplica pagando con Tarjetas de Débito y/o Crédito Scotiabank e ingresando código de descuento: SCOTIASEB24 . El despacho y los tiempos del mismo son de exclusiva responsabilidad del comercio. Promoción no acumulable con otras promociones, ni sobre el costo del despacho. Se excluyen de esta promoción las Tarjetas Empresariales, Corporativas, Mastercard Business, Visa Business, Visa Enjoy, Visa Movistar, Visa Forum, Visa Congelada, Visa Crédito Express, Visa Bex y Tarjeta Universal, al igual que las Tarjetas de Crédito Cencosud Scotiabank, emitidas por su filial.",Banco ScotiaBank
Noa Joyas Todos los días," Válido para compras sobre $40.000 pesos.
Pagando con Tarjetas de Crédito y/o Débito Scotia.
El despacho y los tiempos del mismo son de exclusiva responsabilidad del comercio.
No incluye costo de despacho. 
Excluye colección oro. Promoción válida todos los días de marzo 2025. Promoción consiste en un 20% Dcto. en Noa Joyas a través de  para compras sobre $40.000 pesos. Accede a este beneficio pagando con Tarjetas de Débito y Crédito Scotiabank e ingresando código de descuento SCOTIANOA. El despacho y los tiempos del mismo son de exclusiva responsabilidad del comercio. No incluye costo de despacho. Promoción no acumulable con otras promociones o descuentos. Se excluyen de esta promoción las Tarjetas  Empresariales, Corporativas, Mastercard Business, Visa Business, Visa Enjoy, Visa Movistar, Visa Forum, Visa Congelada, Visa Crédito Express, Visa Bex y Tarjeta Universal, al igual que las Tarjetas de Crédito Cencosud Scotiabank, emitidas por su filial. el pago con tarjetas de crédito puede tener costos asociados. Consulta con el emisor de la tarjeta para mayor información.",Banco ScotiaBank
